Engineering Mechanics - Statics (Static Study Pack);"R.C. Hibbler, Peter Schiavone, Joe Guarino";/images/textbooks/R0/C0/B/0.jpeg
Mechanics for Engineers - Statics and Dynamics (Solutions Manual);R.C. Hibbler;/images/textbooks/R0/C0/B/1.jpeg
"Engineering Mechanics - Statics & Dynamics, Third Custom Edition For The University Of Saskatchewan";R.C. Hibbler;/images/textbooks/R0/C0/B/3.jpeg
"Engineering Mechanics - Statics & Dynamics, Ninth Edition";R.C. Hibbler;/images/textbooks/R0/C0/B/4.jpeg
"Engineering Mechanics - Dynamics, 11th Edition in SI Units (Dynamics Study Pack)";"R.C. Hibbler, Peter Schiavone";/images/textbooks/R0/C0/B/5.jpeg
"Engineering Mechanics - Statics, Tenth Edition (Static Study Pack) - Blue";"R.C. Hibbler, Peter Schiavone";/images/textbooks/R0/C0/B/6.jpeg
"Engineering Mechanics - Statics, Tenth Edition (Static Study Pack) - Red";R.C. Hibbler;/images/textbooks/R0/C0/B/7.jpeg
"Engineering Mechanics - Dynamics, 11th Edition in SI Units";R.C. Hibbler;/images/textbooks/R0/C0/B/8.jpeg
"Engineering Mechanics - Statics, 11th Edition in SI Units";R.C. Hibbler;/images/textbooks/R0/C0/B/9.jpeg
"Engineering Mechanics - Statics, 11th Edition in SI Units (Statics Study Pack)";"R.C. Hibbler, Peter Schiavone";/images/textbooks/R0/C0/B/10.jpeg
"Mechanics for Engineers - Statics and Dynamics, Tenth Edition";R.C. Hibbler;/images/textbooks/R0/C0/B/11.jpeg
"Mechanics for Engineers - Statics and Dynamics, Tenth Edition";R.C. Hibbler;/images/textbooks/R0/C0/B/12.jpeg
Electronics Technology Fundamentals;"Robert T. Paynter, B.J. Toby Boydell";/images/textbooks/R0/C0/F/0.jpeg
Principles of Electronic Materials and Devices - Second Edition;S.O. Kasap;/images/textbooks/R0/C0/F/1.jpeg
Principles of Electrical Engineering Materials and Deivces;S.O. Kasap;/images/textbooks/R0/C0/F/2.jpeg
Principles of Electrical Engineering Materials and Deivces - Revised Edition;S.O. Kasap;/images/textbooks/R0/C0/F/3.jpeg
Degarmo's Materials and Processes in Manufacturing;"JT. Black, Ronald A. Kohser";/images/textbooks/R0/C0/F/4.jpeg
Technical Drawing with Engineering Graphics;"Gisecke, Mitchell, Spencer, Hill, Dygdon, Novak, Lockhart";/images/textbooks/R0/C0/F/5.jpeg
Engineering Ethics;Charles B. Fleddermann;/images/textbooks/R0/C0/F/6.jpeg
Engineering Management - Creating and Managing World-Class Operations;W. Dale Compton;/images/textbooks/R0/C0/F/7.jpeg
"Physics for Scientists and Engineers, Volume Two, Seventh Edition (Solution Manual and Study Guide)";"Gordon, McGrew, Serway, Jewet";/images/textbooks/R0/C1/B/0.jpeg
"Physics for Scientists and Engineers, Volume Two, Seventh Edition (Solution Manual and Study Guide)";"Gordon, McGrew, Serway, Jewet";/images/textbooks/R0/C1/B/1.jpeg
"Physics For Scientists and Engineers, with Modern Physics, Eigth Edition, Volume 2";"Serway, Jewet";/images/textbooks/R0/C1/B/2.jpeg
"Physics, The Nature of Things";"Susan M. Lea, John Robert Burke";/images/textbooks/R0/C1/B/3.jpeg
"Physics, 7th Edition (Student Study Guide)";Cutnell & Johnson;/images/textbooks/R0/C1/B/5.jpeg
"Physics, 7th Edition (Student Solutions Manual)";Cutnell & Johnson;/images/textbooks/R0/C1/B/6.jpeg
"Physics, 7th Edition";Cutnell & Johnson;/images/textbooks/R0/C1/B/7.jpeg
"Physics for Scientists and Engineers, Volume Two, Seventh Edition";"Serway, Jewet";/images/textbooks/R0/C1/B/8.jpeg
"Physics for Scientists and Engineers, Volume Two, Seventh Edition";"Serway, Jewet";/images/textbooks/R0/C1/B/9.jpeg
"Microelectronic Circuits, Sixth Edition";"Sandra, Smith";/images/textbooks/R0/C1/F/0.jpeg
"Calculus, A Complete Course, Ninth Edition";"Robert A. Adams, Christopher Essex";/images/textbooks/R0/C1/F/1.jpeg
"Introductory Circuit Analysis, Eleventh Edition (Solutions Manual, Laboratory Manual To Accompany)";"Robert L. Boylestad, Gabriel Kousourou";/images/textbooks/R0/C1/F/2.jpeg
"Modern Digital and Analog Communication Systems, Third Edition";B.P. Lathi;/images/textbooks/R0/C1/F/3.jpeg
EE498;;/images/textbooks/R0/C1/F/4.jpeg
EE444;;/images/textbooks/R0/C1/F/5.jpeg
EE441*;;/images/textbooks/R0/C1/F/6.jpeg
"Chemistry, Fifth Edition";"Gilbert, Kirss, Foster, Bretz, Daves";/images/textbooks/R0/C1/F/7.jpeg